,Unnamed: 0,id,title,abstrct,snippets,formatDisplay,newspaper,date,articleType,wordCount,onlineUrl,description,illustrated,cleanedSnip,cleanedAbstract,cleanedTitle,combined_text,cluster,text,cleanedText,year,recipe_type
191,191,158942248,Useful Recipes.,"HOW TO KEEP FRESH MEAT.—Perhaps all our readers are not aware that steak (pork and beef), sausages, &c., can be kept fresh ""all the year round,"" by seasoning and frying when fresh, the","[' digestible. The cele brated Indian and<em>Chinese</em> dish called dcM has «° lef!PJ? ^or if8 chief <em>ingredient</em> and is', ' from fresh fnut. I specially recommend the <em>recipe</em> for antsesss*-**-""A To PRESERVE FRUITS Withotit <em>SUGAR</em>']",Article,Adelaide Observer (SA : 1843 - 1904),Saturday 23 July 1870,Article,1123,,,False,  digestible cele brate indian andchinese dish call dcm   lefpj if8 chief ingredient   fresh fnut specially recommend recipe antsesssa preserve fruit withotit sugar,fresh meatperhap reader aware steak pork beef sausage c keep fresh year round season fry fresh,useful recipe,fresh meatperhap reader aware steak pork beef sausage c keep fresh year round season fry fresh   digestible cele brate indian andchinese dish call dcm   lefpj if8 chief ingredient   fresh fnut specially recommend recipe antsesssa preserve fruit withotit sugar Useful Recipes.,2,"How TO KEEP FRESH MEAT.-Perhaps s^4{^aa!5s3sssijfts through. This is valuable information to those who are nimble to procure fresh meat during the summer. It is not easy to detect anv diflferpm* meat thus preserved and that recently Excelijent RECIPE FOR Botiung FRXTTT. -To 9 lbs. of fruit nut 5 lbs. white sugar, when it comes to a boiL Boil 10 minutes, fie careful to stir the fruit as little as possible, not to braise it P^2r m5°- earthenware vessel to cooL When Ejiiw?? m wide-necked bottles, cover with a ITS are n°w using gooseberries, black cunants, andT raspberries mixed, i^r> you can hardly tell from fresh fnut. I specially recommend the recipe for antsesss*-**-""A To PRESERVE FRUITS Withotit SUGAR. -Cnnants, damson^ and plums are TfgiWh j *eP'|®esetwo yeara,and they have been as ff r^ygh . j.UBt Bafhered from the garden. Soil the froitsintlie usual way. H&ve ready jars op wide-mouthed bottles, which have been he/d over a vapour, caused by throwing a little flour of sdnhuron your stove; then while thevapour is thejarfiU up with thefrSt «Ett « pottible, till within three inches of the ton, then btick three little wax vesta matches into the fruit, leaving the pbosphorooa ends standing up about an inch, when the bladder is damped and ready to use, set Are to the matches, and tie over quickly W Urr1 Kg' 611 the air is exhausted the * i1 ve never known fruit done in teKHouslreCOmmend ^ toalL ORANGE MARMALADE. -Cut the oranges (Seville) in halves, take out the pulp and «Sn thai bod the peels in a large quantity of water xvhlj?°!£j?1*njpzigiV1 j water two or three tinmm. ffiP dfalf!d cat them intothS thf PnJP from the skin and pipe, «5?f f0^ P^R.take an equal weight of «£££ and 6011 lA.np «5?tly with die pulp until it the&add ""}c peel and boil gently for half an hour. The peels of oranges used for wine may be employed, but in this cue thejuioe of sweet oranges most be substituted for the pulp* skins of sweet oranges are useless for marmalades.-M. M. Another f^Bes and remove the nnd, throwing it as yon take it off into a basin of ^ Ta k duiM BSSSs,5uStarffl,fiirfiitf® chjmging the water once or twice) till it iTso traderthat the head of.a pin will easily pierce it. Drain the nod on a sieve; and when quite cold remove with a silver knife all the white part. Then cut it into fine strips, add all the pulp and juice, and alto strained lemon juice; in the nro £2Iti°P of dj lemons to the three dozen oranges. Weigh all this together, and for every pound take equal weight or coarse lump sugar. Let the orange bou for a few minutes before you add the sugar, then boil all till the marmalade is quite clear and of a nice consistency. It most be stuied all the time it is boiling, and the thick scum t»iw» ofl as it rises. When nearly cold store it in jars for use.-Geoegiana. j j COOKING Vegetables. -For a chean yet tasty and substantial dish.Uet me suggest that the h9usewife grate two carrots, two turnips, one parsnip, a little beet-root and artichoke, into one pintof split pais, boiled in two quite of £St f<SJ5° h°ure- The whole might then be boiled inth three tessponfuis of IndSSTwhStet or Scotch med, mixed in cold water, leaving it to simmer together for two hours more; a little parsley, mint; and thyme, will flavour the dish! More water might be added if necessary. This aofpewtat complicated ""hodge-podge*' would well satisfy a middle-class family, and cost less, at any rate, than a joint It would not do perhaps every day, tat might occasionally save the meat and avoid the honor of stinting at dinner. For a cheaper dish, why should not Che lentil be intro duced for everyday use in ltnpio.^ as in France? For instance, let a pint of lentils be soaked in pure raft water for 24 hours; then put in a stewpan (earthen our enamelled is best), and boiled for four «H5f *""en two onions, one parsnip, one carrot. ^ and a small quantity of boiled nee should be added. This, mixed and boiled a short time together, would produce a sataBfymg and savouiy dish, somewhat better than the diet of the Belgian miner, and vet very cheap. Lentils are about the most nutritious vegetable we possess. In 100 lbs. they contain 84 agsnswptfnuBg flah-fomdng principle, and 14*3 that gives heat The nee has 82 per cent of the heat-forming principle. Compared with these, the other vege tables are more useful as Riving water, flavour, and and digestible. The cele brated Indian andChinese dish called dcM has «° lef!PJ? ^or if8 chief ingredient and is purely of vegetable matter, it ib rahstantijj «nri a 9nart ot split lentils till, they forma thick soup; nave ready a pound of nee, well boiled in tnillr, and dminaJ off as dry as possible. _ Shake the rice up loosely in a dun, an<L after mixing an ounce of currypowder with the lentils; poor the lentil soup over the rice and serve it up. Dishes, cheaper even than these, may be made palatable, fiefore concluding, how ever. there is one important objection which has often been made, through ignorance of the first rule in cooking vegetables. It is observed a meal from them is not satisfying. I have fnnn^ it frequently happen that the persons who thug objected did not know even how to boil a vegetable. The rule is simple, but must never be forgotten. Ujery kind of vegetable intended to be served whole.should, when put to boii, be placed atonce in boiling water; and this applies especially to potatoes and vegetables from which tbeouteroover has been removed. Now it often happens that potatoes, &c.. are, to save time, placed in cold water and left to boil gradually. It is just this which allows the nutritions nnfift to -""nre. and renders the meal unsatisfying. When/on the contrary, the water boils from the moment the vegetable is Immersed in it the albumen is partially coagulated near the surface, and serves to retain the virtue of the vegetable. The reverse is of comae the rale for making amp, or any dish from which the wattt wiDTnoTbe drained. By pladng tibe vegetables in cold water the albumen is atari? dissolved, and actually mixes with the water^a pro«s most neepmry for the production of nutritions soup. It ta to be hoped that thepomi who have a speaal need for the most theirmbaev can produc^ wiU learn, fa whatever haste thev may ""be, not to boil all the albumen from tiwr Potatoes, reserving for their meal only tWtarehy matter. -Food Journal, |",fresh meatperhaps s4aa5s3sssijft valuable information nimble procure fresh meat summer easy detect anv diflferpm meat preserve recently excelijent recipe botiung frxttt 9 lbs fruit nut 5 lbs white sugar come boil boil 10 minute fie careful stir fruit little possible braise p2r m5 earthenware vessel cool ejiiw m widenecke bottle cover nw gooseberry black cunant andt raspberry mix ir hardly tell fresh fnut specially recommend recipe antsesssa preserve fruit withotit sugar cnnant damson plum tfgiwh j epesetwo yearaand ff rygh   jubt bafhere garden soil froitsintlie usual way hve ready jar op widemouthe bottle d vapour cause throw little flour sdnhuron stove thevapour thejarfiu thefrst ett   pottible till inch ton btick little wax vesta match fruit leave pbosphorooa end stand inch bladder damp ready use set match tie quickly w urr1 kg 611 air exhaust   i1 ve know fruit tekhouslrecommend   toall orange marmalade cut orange seville half pulp sn thai bod peel large quantity water xvhljj1njpzigiv1 j water tinmm ffip dfalfd cat intoth thf pnjp skin pipe 5f f0 prtake equal weight   6011 lanp 5tly die pulp theadd c peel boil gently half hour peel orange wine employ cue thejuioe sweet orange substitute pulp skin sweet orange useless marmaladesm m fbe remove nnd throw yon basin   ta k duim bssss5ustarfflfiirfiitf chjmge water twice till itso traderthat head ofa pin easily pierce drain nod sieve cold remove silver knife white cut fine strip add pulp juice alto strain lemon juice nro 2itip dj lemon dozen orange weigh pound equal weight coarse lump sugar let orange bou minute add sugar boil till marmalade clear nice consistency stuie time boil thick scum tiw ofl rise nearly cold store jar usegeoegiana j j cook vegetable chean tasty substantial dishuet suggest h9usewife grate carrot turnip parsnip little beetroot artichoke pintof split pais boil st fsj5 hure boil inth tessponfuis indsstwhstet scotch med mixed cold water leave simmer hour little parsley mint thyme flavour dish water add necessary aofpewtat complicated hodgepodge satisfy middleclass family cost rate joint day tat occasionally save meat avoid honor stint dinner cheap dish che lentil intro duce everyday use ltnpio france instance let pint lentil soak pure raft water 24 hour stewpan earthen enamel good boil h5f en onion parsnip carrot   small quantity boil nee add mix boil short time produce satabfymg savouiy dish somewhat well diet belgian miner vet cheap lentil nutritious vegetable possess 100 lbs contain 84 agsnswptfnubg flahfomdng principle 143 give heat nee 82 cent heatforme principle compare vege table useful rive water flavour digestible cele brate indian andchinese dish call dcm   lefpj if8 chief ingredient purely vegetable matter ib rahstantijj nri 9nart ot split lentil till forma thick soup nave ready pound nee boil tnillr dminaj dry possible _ shake rice loosely dun anl mix ounce currypowder lentil poor lentil soup rice serve dish cheap palatable fiefore conclude important objection ignorance rule cooking vegetable observe meal satisfy fnnn frequently happen person thug object know boil vegetable rule simple forget ujery kind vegetable intend serve wholeshould boii place atonce boiling water apply especially potato vegetable tbeouteroover remove happen potato c save time place cold water leave boil gradually allow nutrition nnfift nre render meal unsatisfying whenon contrary water boil moment vegetable immerse albuman partially coagulate near surface serve retain virtue vegetable reverse comae rale make amp dish wattt widtnotbe drain pladng tibe vegetable cold water albuman atari dissolve actually mix watera pro neepmry production nutrition soup ta hope thepomi speaal need theirmbaev produc wiu learn fa haste thev boil albuman tiwr potato reserve meal twtarehy matter food journal,1870,dahl
446,446,137586715,MELON JAM WITH GREEN GINGER.,"""Inquirer.""—""Housewife"" kindly forwards a recipe for the jam which I was unable to give last week. The quantity is for 201b., and it is made as follows:—20lb. of","[' can be bought from the <em>Chinese</em> or from Mr. Germain NicoUon, grocer. 1 am indebted to another', 'MELON JAM WITH GREEN GINGER. "" Inquirer.""-"" Housewife"" kindly forwards a <em>recipe</em> for the jam which I']",Article,"The Australasian (Melbourne, Vic. : 1864 - 1946)",Saturday 14 April 1883,Article,393,,,False,  buy chinese mr germain nicouon grocer 1 indebted melon jam green ginger   inquirer housewife kindly forward recipe jam,inquirerhousewife kindly forward recipe jam unable week quantity 201b follows20 lb,melon jam green ginger,inquirerhousewife kindly forward recipe jam unable week quantity 201b follows20 lb   buy chinese mr germain nicouon grocer 1 indebted melon jam green ginger   inquirer housewife kindly forward recipe jam MELON JAM WITH GREEN GINGER.,2,"MELON JAM WITH GREEN GINGER. "" Inquirer.""-"" Housewife"" kindly for wards a recipe for the jam which I was unable to give laBt week. The quantity ia for 201b., and it is made as follows201b. of melon cut into large pieces, 201b. of Bugar, the rind and juice of four lemons, 2oz. ot green ginger boiled and Bliced, and one teaepoonful oi ca>enue pepper tied tightly in a thick piece of muslin. Boil all together till the melon is clear ; when cooked take out the pepper, add one glass of brandy. N. B -Green ginger can be bought from the Chinese or from Mr. Germain NicoUon, grocer. 1 am indebted to another correspondent, "" E. C. K.,"" for the following recipe, which somewhat differs from the foregoing:-15lb. of melon, fib. sugar to each pound of fruit, 2oz. green ginger, half a tabiespoonfol of taitaric acid, eiz lemons, and a pinch of cayenne pepper. Peel the melon and remove all seeds, cut into pieces, then soak in lime water for about 12 hours (a handful of lime to half a gallon of water); take oat the melon, sprinkle half the sugar over it, and let it Btand for another 12 hours; add the rest of the sugar, peel the lemons and take out the eeeds, bruise the ginger. Pat the melon in preserving pan, and when it comes to the boil add the lemonB, ginger, pepper, and acid. Boil for five hours. Dry giuger may be need instead of green, if ao bruise well and tie in a muslin bag. Another correspondent, "" E. N.,"" ia kind enough, also, to send a recipe. "" E. C. K."" kiudly Bends the following re cipes : MELON MABMALA.DE (TO make 101b) -To each pound of fruit allow fib. of sugar; re move the peel from eight oranges, and Bqueeze the pulp through a sieve; boS the peel until soft, changing the water twice to remove the bitteraesB; then shred very finely ; add one cupful of tbe water in which tbe peel was first boiled, and one ounce of tartaric acid to the other ingredients, and boil the whole for from three to four hours. COVEB FOB JAH JABS - A. very simple and effective way of covering jam jars is to dip very thin paper in milk, and place on the jars whilst wet",melon jam green ginger   inquirer housewife kindly ward recipe jam unable labt week quantity ia 201b follows201b melon cut large piece 201b bugar rind juice lemon 2 oz ot green ginger boil blice teaepoonful oi caenue pepper tie tightly thick piece muslin boil till melon clear   cook pepper add glass brandy n b green ginger buy chinese mr germain nicouon grocer 1 indebted correspondent   e c k following recipe somewhat differ foregoing15 lb melon fib sugar pound fruit 2 oz green ginger half tabiespoonfol taitaric acid eiz lemon pinch cayenne pepper peel melon remove seed cut piece soak lime water 12 hour handful lime half gallon water oat melon sprinkle half sugar let btand 12 hour add rest sugar peel lemon eeed bruise ginger pat melon preserve pan come boil add lemonb ginger pepper acid boil hour dry giuger need instead green ao bruise tie muslin bag correspondent   e n ia kind send recipe   e c k kiudly bend follow cipe   melon mabmalade 101b pound fruit allow fib sugar peel orange bqueeze pulp sieve bo peel soft change water twice remove bitteraesb shre finely   add cupful tbe water tbe peel boil ounce tartaric acid ingredient boil hour coveb fob jah jabs   simple effective way cover jam jar dip thin paper milk place jar whilst wet,1883,melon jam
